name,ring,quadrant,isNew,description
Vue.js,adopt,Languages & frameworks,FALSE,Vue.js — JavaScript-фреймворк с открытым исходным кодом для создания пользовательских интерфейсов. Легко интегрируется в проекты с использованием других JavaScript-библиотек. Может функционировать как веб-фреймворк для разработки одностраничных приложений в реактивном стиле.
ExtJS,hold,Languages & frameworks,FALSE,Ext JS — библиотека JavaScript для разработки веб-приложений и пользовательских интерфейсов, изначально задуманная как расширенная версия Yahoo! UI Library, однако преобразовавшаяся затем в отдельный фреймворк. До версии 4.0 использовала адаптеры для доступа к библиотекам Yahoo!
Django,adopt,Languages & frameworks,FALSE,Django — свободный фреймворк для веб-приложений на языке Python, использующий шаблон проектирования MVC. Проект поддерживается организацией Django Software Foundation. Сайт на Django строится из одного или нескольких приложений, которые рекомендуется делать отчуждаемыми и подключаемыми
Flask,adopt,Languages & frameworks,FALSE,Flask — фреймворк для создания веб-приложений на языке программирования Python, использующий набор инструментов Werkzeug, а также шаблонизатор Jinja2. Относится к категории так называемых микрофреймворков — минималистичных каркасов веб-приложений, сознательно предоставляющих лишь самые базовые возможности.
Symphony,hold,Languages & frameworks,FALSE,Symfony — свободный фреймворк, написанный на PHP. Symfony предлагает быструю разработку и управление веб-приложениями, позволяет легко решать рутинные задачи веб-программиста. Работает только с PHP 5 и выше. Имеет поддержку множества баз данных.
ASP.Net,hold,Platforms,FALSE,ASP.Net - платформа разработки веб-приложений, в состав которой входит: веб-сервисы, программная инфраструктура, модель программирования, от компании Майкрософт. ASP.NET входит в состав платформы .NET Framework и является развитием более старой технологии Microsoft ASP.
Atlassian UI,adopt,Languages & frameworks,FALSE,AUI - Atlassian User Interface library.
Asyncio,adopt,Languages & frameworks,FALSE,asyncio is a library to write concurrent code using the async/await syntax. (Python)
Aiohttp,adopt,Languages & frameworks,FALSE,Asynchronous HTTP Client/Server for asyncio and Python.
SQLAlchemy,adopt,Languages & frameworks,FALSE,SQLAlchemy — это программная библиотека на языке Python для работы с реляционными СУБД с применением технологии ORM. Служит для синхронизации объектов Python и записей реляционной базы данных. SQLAlchemy позволяет описывать структуры баз данных и способы взаимодействия с ними на языке Python без использования SQL
Spring Framework,adopt,Languages & frameworks,FALSE,Spring Framework — универсальный фреймворк с открытым исходным кодом для Java-платформы. Также существует форк для платформы .NET Framework, названный Spring.NET.
Reactive,adopt,Languages & frameworks,FALSE,Реализация reactive streams
Boost,adopt,Languages & frameworks,FALSE,Boost — собрание библиотек классов, использующих функциональность языка C++ и предоставляющих удобный кроссплатформенный высокоуровневый интерфейс для лаконичного кодирования различных повседневных подзадач программирования. Свободно распространяются по лицензии Boost Software License вместе с исходным кодом.
Entity Framework,adopt,Languages & frameworks,FALSE,Entity Framework — объектно-ориентированная технология доступа к данным, является object-relational mapping решением для .NET Framework от Microsoft. Предоставляет возможность взаимодействия с объектами как посредством LINQ в виде LINQ to Entities, так и с использованием Entity SQL.
Toothpick,hold,Languages & frameworks,FALSE,Toothpick is a scope tree based Dependency Injection (DI) library for Java.
Unity 3d,trial,Platforms,FALSE,Unity — межплатформенная среда разработки компьютерных игр, разработанная американской компанией Unity Technologies. Unity позволяет создавать приложения, работающие на более чем 25 различных платформах, включающих персональные компьютеры, игровые консоли, мобильные устройства, интернет-приложения и другие.
SAP BO,adopt,Platforms,FALSE,SAP BusinessObjects - компания по разработке программного обеспечения для предприятий, специализирующаяся на бизнес-аналитике. BusinessObjects был приобретен в 2007 году немецкой компанией SAP AG.
Ataccama,adopt,Data management,FALSE,Ataccama delivers AI-powered data curation with Ataccama ONE. It’s a robust platform integrating Data Discovery & Profiling, Data Catalog & Business Glossary, Data Quality Management, Big Data Processing & Data Integration, and Master & Reference Data Management. Ataccama ONE gives you the option to start with what you need and seamlessly extend as your business requires. The platform combines collaborative data stewardship, a robust data processing engine, machine learning, multiple deployment options, and enterprise-grade capabilities.
ESE JetBlue,hold,Data management,FALSE,Extensible Storage Engine, также известный как JET Blue, представляет собой технологию хранения данных ISAM от Microsoft. ESE является ядром Microsoft Exchange Server, Active Directory и Windows Search.
Keepalived,adopt,Tools,FALSE,Keepalived - это программный комплекс обеспечивающий высокую доступность и балансировку нагрузки.
MinIO,adopt,Data management,FALSE,MinIO - это сервер облачного хранилища, совместимый с Amazon S3, выпущенный под лицензией Apache License v2. Как хранилище объектов, MinIO может хранить неструктурированные данные, такие как фотографии, видео, файлы журналов, резервные копии и изображения контейнеров. Максимальный размер объекта составляет 5 ТБ
Haml,hold,Languages & frameworks,FALSE,Haml — язык разметки для упрощённой генерации HTML. HAML компилируется в HTML. Эквивалент Haml для CSS — это LESS или Sass.
SASS,hold,Languages & frameworks,FALSE,Sass — модуль, включенный в Haml. Sass — это метаязык на основе CSS, предназначенный для увеличения уровня абстракции CSS-кода и упрощения файлов каскадных таблиц стилей. Язык Sass имеет два синтаксиса: sass — отличается отсутствием фигурных скобок, в нём вложенные элементы реализованы с помощью отступов
ClickHouse,adopt,Data management,FALSE,ClickHouse — это колоночная аналитическая СУБД с открытым кодом, позволяющая выполнять аналитические запросы в режиме реального времени на структурированных больших данных, разрабатываемая компанией Яндекс.
Tarantool,trial,Data management,FALSE,Tarantool — открытая система управления базой данных с неблокирующим сервером приложений на Lua. База данных обладает высокой скоростью работы по сравнению с традиционными СУБД, обладая теми же свойствами: персистентности, транзакционности ACID, репликации master-slave, master-master.
pgSQL,hold,Languages & frameworks,FALSE,"PL/pgSQL — процедурное расширение языка SQL, используемое в СУБД PostgreSQL. Этот язык предназначен для написания функций, триггеров и правил и обладает следующими особенностями: добавляет управляющие конструкции к стандарту SQL, допускает сложные вычисления,"
Apache Cassandra,trial,Data management,FALSE,Apache Cassandra — распределённая система управления базами данных, относящаяся к классу NoSQL-систем и рассчитанная на создание высокомасштабируемых и надёжных хранилищ огромных массивов данных, представленных в виде хэша.
Asterisk,adopt,Tools,FALSE,Asterisk — свободное решение компьютерной телефонии с открытым исходным кодом от компании Digium, первоначально разработанное Марком Спенсером. Приложение работает на операционных системах Linux, FreeBSD, OpenBSD и Solaris и др.
Apache ZooKeeper,adopt,Tools,FALSE,Apache ZooKeeper - это программный проект Apache Software Foundation. По сути, это служба для распределенных систем, предлагающая иерархическое хранилище значений ключей, которое используется для предоставления службы распределенной конфигурации, службы синхронизации и реестра имен для больших распределенных систем.
Apache Hadoop,trial,Tools,FALSE,Hadoop — проект фонда Apache Software Foundation, свободно распространяемый набор утилит, библиотек и фреймворк для разработки и выполнения распределённых программ, работающих на кластерах из сотен и тысяч узлов.
Apache Hive,trial,Data management,FALSE,Apache Hive — система управления базами данных на основе платформы Hadoop. Позволяет выполнять запросы, агрегировать и анализировать данные, хранящиеся в Hadoop. Apache Hive был создан корпорацией Facebook и передан под открытой лицензией в собственность фонду Apache Software Foundation.
Apache NiFi,trial,Tools,FALSE,Apache NiFi - это программный проект от Apache Software Foundation, предназначенный для автоматизации потока данных между программными системами.
Apache Camel,adopt,Languages & frameworks,FALSE,Apache Camel — открытый кроссплатформенный java-фреймворк, который позволяет проводить интеграцию приложений в простой и понятной форме. Идеологически основан на Шаблонах Интеграции Корпоративных Приложений. Особенности: Гибкая маршрутизация сообщений Более 70-ти различных компонентов для доступа к данным
Корпоративная шина данных,adopt,Platforms,FALSE,Stoloto ESB
Apache ServiceMix,hold,Platforms,FALSE,Apache ServiceMix — пакет для создания композитных приложений, базирующийся на концепции корпоративной сервисной шины и комбинирующий сервис-ориентированную архитектуру и событийно-ориентированную архитектуру. ServiceMix реализует также спецификацию Java Business Integration, хотя последняя теряет свою популярность.
Jetty,adopt,Tools,FALSE,Jetty — свободный контейнер сервлетов, написанный полностью на Java. Может использоваться как HTTP-сервер или в паре со специализированным HTTP-сервером.
Liquibase,adopt,Tools,FALSE,Liquibase - это независимая от базы данных библиотека с открытым исходным кодом для отслеживания, управления и применения изменений схемы базы данных. Он был запущен в 2006 году, чтобы упростить отслеживание изменений в базе данных, особенно в гибкой среде разработки программного обеспечения.
Swift,adopt,Languages & frameworks,TRUE,Swift — открытый мультипарадигмальный компилируемый язык программирования общего назначения. Создан компанией Apple в первую очередь для разработчиков iOS и macOS. Swift работает с фреймворками Cocoa и Cocoa Touch и совместим с основной кодовой базой Apple, написанной на Objective-C.
SwiftUI,adopt,Languages & frameworks,TRUE,UI Framework
UIKit,hold,Languages & frameworks,FALSE,UI Framework
Objective-C,hold,Languages & frameworks,FALSE,Objective-C — компилируемый объектно-ориентированный язык программирования, используемый корпорацией Apple, построенный на основе языка Си и парадигм Smalltalk. В частности, объектная модель построена в стиле Smalltalk — то есть объектам посылаются сообщения.
